{
  "caseId": "GS-02",
  "version": "0.1.0",
  "title": "Definition / population mismatch case: a 30% drop that is mostly a change in who is counted",
  "kind": "synthetic",
  "goldenSetIndex": 2,
  "dimensions": [
    "population / period / unit comparability",
    "deterministic calculation correctness",
    "expectation provenance integrity",
    "limitations disclosure",
    "publication-readiness honesty"
  ],
  "input": {
    "researchQuestion": "Did the number of registered vendors on the platform fall between 2021 and 2024?",
    "stage": "EXPLORATORY",
    "datasets": [
      {
        "id": "ds-2021",
        "role": "hypothesis_generation",
        "sourceKind": "primary",
        "description": "Fictional 2021 vendor count. Includes inactive vendors.",
        "populationDefinitionId": "vendors_incl_inactive",
        "harmonizationMethod": "observed",
        "unit": "vendors",
        "rows": [{"key": "total", "value": 50000}]
      },
      {
        "id": "ds-2024-published",
        "role": "hypothesis_generation",
        "sourceKind": "primary",
        "description": "Fictional 2024 published count. The 2024 methodology note says inactive vendors were dropped from the population.",
        "populationDefinitionId": "vendors_excl_inactive",
        "harmonizationMethod": "observed",
        "unit": "vendors",
        "rows": [{"key": "total", "value": 35000}]
      },
      {
        "id": "ds-2024-reference",
        "role": "validation",
        "sourceKind": "primary",
        "description": "Fictional 2024 reference table that adds the inactive segment back using the 2021 inactive count (carry-forward).",
        "populationDefinitionId": "vendors_incl_inactive",
        "harmonizationMethod": "carry_forward_2021_inactive",
        "unit": "vendors",
        "rows": [{"key": "total", "value": 46000}]
      }
    ]
  },
  "expected": {
    "verdict": "NOT_COMPARABLE",
    "expectations": [
      {
        "id": "E1",
        "text": "Because the 2024 methodology note drops inactive vendors, the published 2024 total should fall mechanically even if active vendors are flat.",
        "basis": "SOURCE_BACKED",
        "provenance": "PRIOR",
        "declaredBeforeDataSeen": true
      }
    ],
    "hypotheses": [
      {"id": "H1", "role": "PRIMARY", "text": "Vendors genuinely left the platform.", "causalStatus": "OBSERVED_ASSOCIATION", "validationStatus": "INSUFFICIENT_EVIDENCE", "identificationStatus": "NOT_IDENTIFIED"},
      {"id": "H2", "role": "COMPETING", "text": "Most of the apparent drop is the change in population definition.", "causalStatus": "OBSERVED_ASSOCIATION", "validationStatus": "PARTIALLY_SUPPORTED", "identificationStatus": "NOT_IDENTIFIED"}
    ],
    "evidence": [
      {"id": "EV1", "type": "counter", "hypothesisIds": ["H1"], "datasetId": "ds-2024-published", "usage": "generation", "sourceKind": "primary", "traceableToPrimary": true, "summary": "The 2024 methodology note documents the exclusion of inactive vendors; the naive delta is not a like-for-like change."},
      {"id": "EV2", "type": "support", "hypothesisIds": ["H2"], "datasetId": "ds-2024-reference", "usage": "re_analysis", "sourceKind": "primary", "traceableToPrimary": true, "summary": "On the harmonized population the change shrinks from -30.0% to -8.0%."},
      {"id": "EV3", "type": "counter", "hypothesisIds": ["H2"], "datasetId": "ds-2024-reference", "usage": "re_analysis", "sourceKind": "primary", "traceableToPrimary": true, "summary": "A residual -8.0% remains after harmonization, so definition change alone does not explain everything."}
    ],
    "comparisons": [
      {"id": "CMP-naive", "baselineDatasetId": "ds-2021", "baselineRowKey": "total", "currentDatasetId": "ds-2024-published", "currentRowKey": "total", "expectedDelta": -15000, "expectedPctChange": "-30.0", "comparabilityLabel": "NOT_COMPARABLE"},
      {"id": "CMP-harmonized", "baselineDatasetId": "ds-2021", "baselineRowKey": "total", "currentDatasetId": "ds-2024-reference", "currentRowKey": "total", "expectedDelta": -4000, "expectedPctChange": "-8.0", "comparabilityLabel": "HARMONIZED_REFERENCE"}
    ],
    "counterEvidenceSearched": true,
    "mayClaimExhaustiveValidation": false,
    "requiresCounterEvidence": true,
    "requiredLimitations": [
      "The 2021 and published 2024 populations differ; the -30.0% figure must not be presented as a decline.",
      "The harmonized 2024 value carries the 2021 inactive segment forward and is a reference value, not an observation.",
      "The residual -8.0% is a change within the active population only."
    ],
    "requiredResearchGaps": [
      {"category": "MEASUREMENT", "need": "An observed 2024 count of inactive vendors, or the rule used to flag inactivity in both years."},
      {"category": "PRE_PERIOD", "need": "2022 and 2023 counts under a single definition."}
    ],
    "forbiddenClaims": [
      "30%減少した",
      "3割減った",
      "減少が確認された",
      "fell by 30%",
      "declined 30%"
    ]
  },
  "humanReview": {
    "status": "PENDING",
    "reviewer": null,
    "reviewedAt": null,
    "outcome": null,
    "notes": "A passing report must label the naive comparison NOT_COMPARABLE and must not call the harmonized pair COMPARABLE."
  }
}
